{
  "artifact_sha256": "988f3609f216016521e062a5a5d643ea0c80949e4ecbed8523e82776123a1e6a",
  "cohorts": [
    {
      "content_sha256": "d381c115e76542a11600ab33e414a6b9a5f5404e4caa2d850e80953af2029cdc",
      "derived_weights_permitted": true,
      "group_unit": "near-duplicate cluster / aligned human-machine source pair",
      "id": "mage",
      "kind": "prose",
      "license_spdx": "Apache-2.0",
      "n_rows": 15000,
      "notes": "MAGE train portion of the pooled public-weight training pool; valid/test/OOD/paraphrase held out.",
      "provenance": "pooled-train-v2.1 (mage+raid-clean+defactify; derived-weight-licensed)",
      "redistributable": true,
      "role": "training",
      "task_semantics": "binary_ai"
    },
    {
      "content_sha256": "d381c115e76542a11600ab33e414a6b9a5f5404e4caa2d850e80953af2029cdc",
      "derived_weights_permitted": true,
      "group_unit": "source_id (RAID prompt x generator)",
      "id": "raid",
      "kind": "prose",
      "license_spdx": "MIT",
      "n_rows": 14918,
      "notes": "RAID clean (attack='none') portion of the pooled training pool; attack arms are robustness-only.",
      "provenance": "pooled-train-v2.1 (mage+raid-clean+defactify; derived-weight-licensed)",
      "redistributable": true,
      "role": "training",
      "task_semantics": "binary_ai"
    },
    {
      "content_sha256": "d381c115e76542a11600ab33e414a6b9a5f5404e4caa2d850e80953af2029cdc",
      "derived_weights_permitted": true,
      "group_unit": "reconstructed NYT story",
      "id": "defactify",
      "kind": "prose",
      "license_spdx": "CC-BY-4.0",
      "n_rows": 5938,
      "notes": "DeFactify NYT human articles vs 6 LLM families; re-split by story group (official splits are story-leaky).",
      "provenance": "pooled-train-v2.1 (mage+raid-clean+defactify; derived-weight-licensed)",
      "redistributable": true,
      "role": "training",
      "task_semantics": "binary_ai"
    },
    {
      "content_sha256": "970a4e7a996dfe12523b0257eddefb93a7a4e84f61125984279852821e92f9d5",
      "derived_weights_permitted": true,
      "group_unit": "near-duplicate cluster / aligned source pair",
      "id": "mage-ood",
      "kind": "prose",
      "license_spdx": "Apache-2.0",
      "n_rows": 1518,
      "notes": "MAGE out-of-distribution test (unseen generators/domains); sealed eval.",
      "provenance": "mage (Li et al. 2023, arXiv:2305.13242; split=ood, hygiene-filtered, hash-pinned)",
      "redistributable": false,
      "role": "evaluation",
      "task_semantics": "binary_ai"
    },
    {
      "content_sha256": "a92906d69194f6fd349f4c669831edfe7515631e891a3ba3b7a2184e3bfad840",
      "derived_weights_permitted": true,
      "group_unit": "near-duplicate cluster / aligned source pair",
      "id": "mage-ood-paraphrase",
      "kind": "prose",
      "license_spdx": "Apache-2.0",
      "n_rows": 2340,
      "notes": "MAGE OOD paraphrase-attack test; sealed robustness eval.",
      "provenance": "mage (Li et al. 2023, arXiv:2305.13242; split=ood_para, hygiene-filtered, hash-pinned)",
      "redistributable": false,
      "role": "robustness",
      "task_semantics": "robustness_attack"
    },
    {
      "content_sha256": "a638b29eae50abc72b856f4002dd3c89f163aee4249c5e9bfbbdd86269f18ec0",
      "derived_weights_permitted": false,
      "group_unit": "source document",
      "id": "m4gt-english",
      "kind": "prose",
      "license_spdx": "NOASSERTION",
      "n_rows": 4000,
      "notes": "M4GT-Bench Subtask A English; NOASSERTION license -> evaluation-only.",
      "provenance": "m4gt (Wang et al. 2024, arXiv:2403.14822; English, hygiene-filtered, hash-pinned)",
      "redistributable": false,
      "role": "evaluation",
      "task_semantics": "binary_ai"
    },
    {
      "content_sha256": "7014c7dff801fbd08d9d576900b9a366025ad078ebe6ce1c1155b150c38895f8",
      "derived_weights_permitted": false,
      "group_unit": "source document",
      "id": "m4gt-multilingual",
      "kind": "prose",
      "license_spdx": "NOASSERTION",
      "n_rows": 4000,
      "notes": "M4GT-Bench multilingual; external failure/abstention test, not English-model training data.",
      "provenance": "m4gt-multilingual (Wang et al. 2024, arXiv:2403.14822; hygiene-filtered, hash-pinned)",
      "redistributable": false,
      "role": "evaluation",
      "task_semantics": "binary_ai"
    },
    {
      "content_sha256": "7d2960226451bad96ecfe6a02c0fc10efc0f85daa75ac6e217a040eb40171265",
      "derived_weights_permitted": false,
      "group_unit": "group (EvoBench prompt x family)",
      "id": "evobench",
      "kind": "prose",
      "license_spdx": "NOASSERTION",
      "n_rows": 4000,
      "notes": "EvoBench detector generalization across evolving LLM versions; NOASSERTION -> evaluation-only.",
      "provenance": "evobench (ACL 2025 Findings; hygiene-filtered, pinned-commit)",
      "redistributable": false,
      "role": "evaluation",
      "task_semantics": "binary_ai"
    },
    {
      "content_sha256": "5b01609d5b361a6216a6b31aae9bc287df73b4d7a175a007d037e11a95fd86a8",
      "derived_weights_permitted": false,
      "group_unit": "author (Mechanical Turk worker_id)",
      "id": "coauthor",
      "kind": "prose",
      "license_spdx": "NOASSERTION",
      "n_rows": 236,
      "notes": "CoAuthor human+GPT-3 collaborative sessions; participation/contribution task, never a binary fully-AI cell.",
      "provenance": "coauthor (Lee et al. 2022, arXiv:2201.06796; split=test, author-disjoint, hash-pinned)",
      "redistributable": false,
      "role": "mixed_task",
      "task_semantics": "contribution_fraction"
    },
    {
      "content_sha256": "a1d4c0c46d5bb57674932aef71e0185488fad172426d561d2c1077c5f6d03d9b",
      "derived_weights_permitted": false,
      "group_unit": "record id",
      "id": "reference-corpus-v0",
      "kind": "prose",
      "license_spdx": "NOASSERTION",
      "n_rows": 104,
      "notes": "Reference Community Corpus v0 (104 records); infrastructure-load-bearing, not a powered eval cohort.",
      "provenance": "panoptes-verified-corpus",
      "redistributable": false,
      "role": "reference",
      "task_semantics": "binary_ai"
    },
    {
      "content_sha256": "e6cb01399353acc063f5ba5a2ad959604be56a657d4894f2a360fc897c9f42a3",
      "derived_weights_permitted": false,
      "group_unit": "source_id (RAID prompt x generator)",
      "id": "raid-attacks",
      "kind": "prose",
      "license_spdx": "MIT",
      "n_rows": 3957,
      "notes": "RAID attack arms (11): alternative_spelling, article_deletion, homoglyph, insert_paragraphs, number, paraphrase, perplexity_misspelling, synonym, upper_lower, whitespace, zero_width_space. Train-clean/test-attacked robustness cells.",
      "provenance": "raid (Dugan et al. 2024, arXiv:2405.07940; attack=paraphrase, hygiene-filtered, hash-pinned)",
      "redistributable": true,
      "role": "robustness",
      "task_semantics": "robustness_attack"
    }
  ],
  "protocol_ref": {
    "artifact_sha256": "0cef5dfddd45f5dce5e093c48df17415fc59d93980a8000971c33ea64a9d22b7",
    "path": "bench/protocol-v2.1.json"
  },
  "registered_utc": "2026-08-19T19:54:34Z",
  "schema": "panoptes-dataset-registry-v2-1"
}
